{
  "$schema": "https://json-schema.org/draft/2020-12/schema",
  "$id": "https://dprental.com/contracts/schemas/listing-viewed.schema.json",
  "title": "ListingViewed",
  "description": "Event emitted by InventoryService when a public equipment listing detail is successfully viewed.",
  "type": "object",
  "required": [
    "messageId",
    "messageType",
    "version",
    "producer",
    "occurredAt",
    "payload"
  ],
  "properties": {
    "messageId": {
      "$ref": "#/$defs/nonNilUuid"
    },
    "messageType": {
      "type": "string",
      "const": "ListingViewed"
    },
    "version": {
      "type": "integer",
      "const": 1
    },
    "producer": {
      "type": "string",
      "const": "InventoryService"
    },
    "occurredAt": {
      "$ref": "#/$defs/utcIso8601Timestamp"
    },
    "correlationId": {
      "$ref": "#/$defs/nullableCorrelationId"
    },
    "payload": {
      "type": "object",
      "required": [
        "userId",
        "equipmentListingId",
        "equipmentTypeId"
      ],
      "additionalProperties": false,
      "properties": {
        "userId": {
          "$ref": "#/$defs/nullableNonNilUuid"
        },
        "equipmentListingId": {
          "$ref": "#/$defs/nonNilUuid"
        },
        "equipmentTypeId": {
          "$ref": "#/$defs/nonNilUuid"
        }
      }
    }
  },
  "$defs": {
    "nonNilUuid": {
      "type": "string",
      "format": "uuid",
      "pattern": "^(?!00000000-0000-0000-0000-000000000000)[0-9a-fA-F]{8}-[0-9a-fA-F]{4}-[0-9a-fA-F]{4}-[0-9a-fA-F]{4}-[0-9a-fA-F]{12}$"
    },
    "nullableNonNilUuid": {
      "type": ["string", "null"],
      "format": "uuid",
      "pattern": "^(?!00000000-0000-0000-0000-000000000000)[0-9a-fA-F]{8}-[0-9a-fA-F]{4}-[0-9a-fA-F]{4}-[0-9a-fA-F]{4}-[0-9a-fA-F]{12}$"
    },
    "utcIso8601Timestamp": {
      "type": "string",
      "format": "date-time",
      "pattern": "^[0-9]{4}-[0-9]{2}-[0-9]{2}T[0-9]{2}:[0-9]{2}:[0-9]{2}(\\.[0-9]+)?Z$"
    },
    "nullableCorrelationId": {
      "type": ["string", "null"],
      "minLength": 1
    }
  }
}
