{
  "messageId": "11111111-1111-4111-8111-111111111111",
  "messageType": "ListingViewed",
  "version": 1,
  "producer": "InventoryService",
  "occurredAt": "2026-10-19T10:00:00Z",
  "correlationId": "corr-view-001",
  "payload": {
    "userId": "22222222-2222-4222-8222-222222222222",
    "equipmentListingId": "33333333-3333-4333-8333-333333333333",
    "equipmentTypeId": "44444444-4444-4444-8444-444444444444"
  }
}
