{
  "messageId": "11111111-1111-4111-8111-111111111112",
  "messageType": "ListingViewed",
  "version": 1,
  "producer": "InventoryService",
  "occurredAt": "2026-10-19T10:01:00Z",
  "correlationId": null,
  "payload": {
    "userId": null,
    "equipmentListingId": "33333333-3333-4333-8333-333333333333",
    "equipmentTypeId": "44444444-4444-4444-8444-444444444444"
  }
}
